{
  "document_type": "purchase_order",
  "po_number": "PO-1004",
  "vendor": {
    "name": "Umbrella Industries",
    "address": {
      "street": "1 Raccoon Blvd",
      "city": "Raccoon City",
      "state": "MI",
      "postal_code": "48201",
      "country": "US"
    },
    "contact": {
      "email": "payables@umbrella-ind.com",
      "phone": "+1-313-555-0177"
    },
    "tax_id": "23-4567890"
  },
  "currency": "USD",
  "issue_date": "2026-05-06",
  "line_items": [
    {
      "description": "Steel drum, 55gal",
      "quantity": 40,
      "unit_price": 25.0,
      "line_total": 1000.0,
      "sku": "DRM-55"
    }
  ],
  "subtotal": 1000.0,
  "shipping": 50.0,
  "tax": 80.0,
  "discount": 0.0,
  "total": 1130.0
}
